word,Sentence,Document
country,"it's humbling, but in my heart i know you didn't come here just for me, you came here because you believe in what this country can be.
and we should take heart, because we've changed this country before.
for that is our unyielding faith - that in the face of impossible odds, people who love their country can change it.
and let's allow our unions and their organizers to lift up this country's middle-class again.
politics doesn't have to divide us on this anymore - we can work together to keep our country safe.
all of us running for president will travel around the country offering ten-point plans and making grand speeches; all of us will trumpet those qualities we believe make us uniquely qualified to lead the country.
it is that promise that has always set this country apart - that through hard work and sacrifice, each of us can pursue our individual dreams but still come together as one american family, to ensure that the next generation can pursue their dreams as well.
we are a better country than this.
this country is more decent than one where a woman in ohio, on the brink of retirement, finds herself one illness away from disaster after a lifetime of hard work.
this country is more generous than one where a man in indiana has to pack up the equipment he's worked on for twenty years and watch it shipped off to china, and then chokes up as he explains how he felt like a failure when he went home to tell his family the news.
because next week, in minnesota, the same party that brought you two terms of george bush and dick cheney will ask this country for a third.
and we are here because we love this country too much to let the next four years look like the last eight.
the republican nominee, john mccain, has worn the uniform of our country with bravery and distinction, and for that we owe him our gratitude and respect.
you see, we democrats have a very different measure of what constitutes progress in this country.
the fundamentals we use to measure economic strength are whether we are living up to that fundamental promise that has made this country great - a promise that is the only reason i am standing here tonight.
in the face of that young student who sleeps just three hours before working the night shift, i think about my mom, who raised my sister and me on her own while she worked and earned her degree; who once turned to food stamps but was still able to send us to the best schools in the country with the help of student loans and scholarships.
and we will keep our promise to every young american - if you commit to serving your community or your country, we will make sure you can afford a college education.
so don't tell me that democrats won't defend this country.
i love this country, and so do you, and so does john mccain.
we all put our country first.
we may not agree on abortion, but surely we can agree on reducing the number of unwanted pregnancies in this country.
this country of ours has more wealth than any nation, but that's not what makes us rich.
it's a time where you can go to any town hall or street corner or coffee shop and hear people express the same anxiety about the future; hear them convey the same uncertainty about the direction we're headed as a country.
he was talking about what an awful job his own party has done governing this country, and he said that with all the mistakes and misjudgments the republicans have made over the last six years, the slogan for the democrats should come down to just two words:

had enough?
i've had enough of being told that we can't afford body armor for our troops and health care for our veterans and benefits for the wounded heroes who've risked their lives for this country.
and i've had enough of being told that all we can do about this is sit and wait and hope that the good fortune of a few trickles on down to everyone else in this country.
i think he loves his country.
the idea that everybody has a stake in the country, that we're all in it together and everybody's got a shot at opportunity.
and so i am eager to have this argument not just with the president, but the entire republican party over what this country is about.
will she see a country that is freer and kinder, more tolerant and more just than the one she grew up in?
will she see greater opportunities for every citizen of this country?
we are here tonight because we believe that in this country, we have it within our power to say ""yes"" to those questions - to forge our own destiny - to begin the world anew.
our time to leave our children a country that is freer and kinder, more prosperous and more just than the place we grew up.
his ideas about how kenya should progress often put him at odds with the politics of tribe and patronage, and because he spoke his mind, sometimes to a fault, he ended up being fired from his job and prevented from finding work in the country for many, many years.
we know as well the talent, the intelligence, and the creativity that exists in this country.
as a senator from the united states, i believe that my country, and other nations, have an obligation and self-interest in being full partners with kenya and with africa.
you enjoy a robust civil society; a press that's free, fair, and honest; and a strong partnership with my own country that has resulted in critical cooperation on terrorist issues, real strides in fighting disease and poverty, and an important alliance on fostering regional stability.
i know that while recent reports have pointed to strong economic growth in this country, 56% of kenyans still live in poverty.
and i know that the vast majority of people in this country desperately want to change this.
today, we're starting to see that the kenyan people want more than a simple changing of the guard, more than piecemeal reforms to a crisis that's crippling their country.
i don't have all the solutions or think that they'll be easy, but there are a few places that a country truly committed to reform could start.
instead of unifying the country to move forward on solving problems, it divides neighbor from neighbor.
when people are judged by merit, not connections, then the best and brightest can lead the country, people will work hard, and the entire economy will grow - everyone will benefit and more resources will be available for all, not just select groups.
of course, in the end, one of the strongest weapons your country has against corruption is the ability of you, the people, to stand up and speak out about the injustices you see.
by rejecting the insulting idea that corruption is somehow a part of kenyan culture, these heroes reveal the very opposite - they reveal a strength and integrity of character that can build a great country, a great future.
by focusing on building strong, independent institutions - like an anti-corruption commission with real authority - rather than cults of personality, they make a contribution to their country that will last longer than their own lives.
and you will determine the direction of this country in the 21st century - whether the hard work of the many is lost to the selfish desires of a few, or whether you build an open, honest, stronger kenya where everyone rises together.
since that time i have known him through stories - those my mother would tell and those i heard from my relatives here in kenya on my last trip to this country.
that policy-by-slogan will no longer pass as an acceptable form of debate in this country.
these are serious times for our country, and with their votes two weeks ago, americans demanded a feasible strategy with defined goals in iraq ?
a year that is ending with an attempt by the bipartisan iraq study group to determine what can be done about a country that is quickly spiraling out of control.
to reach such a solution, we must communicate clearly and effectively to the factions in iraq that the days of asking, urging, and waiting for them to take control of their own country are coming to an end.
to pressure the iraqi leadership to finally come to a political agreement between the warring factions that can create some sense of stability in the country and bring this conflict under control.
for only through this phased redeployment can we send a clear message to the iraqi factions that the u.s. is not going to hold together this country indefinitely ?
today, the iraqi landscape is littered with ill-conceived, half-finished projects that have done almost nothing to help the iraqi people or stabilize the country.
the first is that we should be more modest in our belief that we can impose democracy on a country through military force.
according to a pew survey, 42% of americans now agree with the statement that the u.s. should ""mind its own business internationally and let other countries get along the best they can on their own.”

we cannot afford to be a country of isolationists right now.
but to guard against isolationist sentiments in this country, we must change conditions in iraq and the policy that has characterized our time there ?
it is time to give iraqis their country back.","doc1.txt,doc2.txt,doc3.txt,doc4.txt,doc5.txt"
government,"i saw that the problems people faced weren't simply local in nature - that the decision to close a steel mill was made by distant executives; that the lack of textbooks and computers in schools could be traced to the skewed priorities of politicians a thousand miles away; and that when a child turns to violence, there's a hole in his heart no government could ever fill.
the genius of our founders is that they designed a system of government that can be changed.
the cynics, and the lobbyists, and the special interests who've turned our government into a game only they can afford to play.
they write the checks and you get stuck with the bills, they get the access while you get to write a letter, they think they own this government, but we're here today to take it back.
and although government will play a crucial role in bringing about the changes we need, more money and programs alone will not get us where we need to go.
these challenges are not all of government's making.
we are more compassionate than a government that lets veterans sleep on our streets and families slide into poverty; that sits on its hands while a major american city drowns before our eyes.
ours is a promise that says government cannot solve all our problems, but what it should do is that which we cannot do for ourselves - protect us from harm and provide every child a decent education; keep our water clean and our toys safe; invest in new schools and new roads and new science and technology.
our government should work for us, not against us.
yes, government must lead on energy independence, but each of us must do our part to make our homes and businesses more efficient.
but we must also admit that programs alone can't replace parents; that government can't turn off the television and make a child do her homework; that fathers must take more responsibility for providing the love and guidance their children need.
and today, as my call for a time frame to remove our troops from iraq has been echoed by the iraqi government and even the bush administration, even after we learned that iraq has a $79 billion surplus while we're wallowing in deficits, john mccain stands alone in his stubborn refusal to end a misguided war.
because it feeds into the cynicism we all have about government.
i've seen it in washington, when we worked across party lines to open up government and hold lobbyists more accountable, to give better care for our veterans and keep nuclear weapons out of terrorist hands.
that even though we may get involved out of civic obligation every few years, we don't always have confidence that government can make a difference in our lives.
in a century just six years old, our faith has been shaken by war and terror, disaster and despair, threats to the middle-class dream, and scandal and corruption in our government.
the sweeping changes brought by revolutions in technology have torn down walls between business and government and people and places all over the globe.
but while the world has changed around us, too often our government has stood still.
the reason they don't believe government has a role in solving national problems is because they think government is the problem.
we know that government can't solve all our problems - and we don't want it to.
the party that won't make americans choose between a health care plan that bankrupts the government and one that bankrupts families.
and let it be said that we are the party of open, honest government that doesn't peddle the agenda of whichever lobbyist or special interest can write the biggest check.
like many nations across this continent, where kenya is failing is in its ability to create a government that is transparent and accountable.
in the end, if the people cannot trust their government to do the job for which it exists - to protect them and to promote their common welfare - all else is lost.
in a true democracy, it is what happens between elections that is the true measure of how a government treats its people.
and we also know that the more people there are on the government payroll, the more likely it is that someone will be encouraged to take a bribe.
so if the government found ways to downsize the bureaucracy - to cut out the positions that aren't necessary or useful - it could use the extra money to increase the salary of other government officials.
clarifying these rules and focusing resources on building a judicial system that can enforce them and resolve disputes should be a primary goal of any government suffering from corruption.
wealth declarations do little good if no one can access them, and accountability in government spending is not possible if no one knows how much was available and allocated to a given project in the first place.
an accountable, transparent government can break this cycle.
dreams of democracy and hopes for a perfect government are now just that ?
the first part of this strategy begins by exerting the greatest leverage we have on the iraqi government ?
that it will be up to them to form a viable government that can effectively run and secure iraq.
when possible, this should be done in consultation with the iraqi government ?
instead of consolidating the gains made by the karzai government, we are backsliding towards chaos.
but only if u.s. commanders think such a force would be effective; if there is substantial movement towards a political solution among iraqi factions; if the iraqi government showed a serious commitment to disbanding the militias; and if the iraqi government asked us ?
in the absence of a genuine commitment on the part of all of the factions in iraq to deal with this issue, it is doubtful that a unified iraqi government can function for long, and it is doubtful that u.s. forces, no matter how large, can prevent an escalation of widespread sectarian killing.
of course, in order to convince the various factions to embark on the admittedly difficult task of disarming their militias, the iraqi government must also make headway on reforming the institutions that support the military and the police.
we can teach the soldiers to fight and police to patrol, but if the iraqi government will not properly feed, adequately pay, or provide them with the equipment they need, they will continue to desert in large numbers, or maintain fealty only to their religious group rather than the national government.
and that is the loss of our government’s credibility with the american people.
and the kiev story is heading in the right direction - while we were in ukraine, dick, through his tireless and personal intervention, was able to achieve a breakthrough with that government, bringing that facility and others under the cooperative threat reduction program.
while the government of ukraine is making progress here, the limited funding they have means that at the current pace, it will take sixty years to dismantle these weapons.","doc1.txt,doc2.txt,doc3.txt,doc4.txt,doc5.txt,doc6.txt"
