word,Sentence,Document
iraq,"and when all else fails, when katrina happens, or the death toll in iraq mounts, we've been told that our crises are somebody else's fault.
but all of this cannot come to pass until we bring an end to this war in iraq.
because in the faces of those young veterans who come back from iraq and afghanistan, i see my grandfather, who signed up after pearl harbor, marched in patton's army, and was rewarded by a grateful nation with the chance to go to college on the gi bill.
for while senator mccain was turning his sights to iraq just days after 9/11, i stood up and opposed this war, knowing that it would distract us from the real threats we face.
and today, as my call for a time frame to remove our troops from iraq has been echoed by the iraqi government and even the bush administration, even after we learned that iraq has a $79 billion surplus while we're wallowing in deficits, john mccain stands alone in his stubborn refusal to end a misguided war.
you don't defeat a terrorist network that operates in eighty countries by occupying iraq.
i will end this war in iraq responsibly, and finish the fight against al qaeda and the taliban in afghanistan.
we've seen our children leave for iraq and terrorists threaten to finish the job they started on 9/11.
that if you say the words ""plan for victory"" and point to the number of schools painted and roads paved and cell phones used in iraq, no one will notice the nearly 2,500 flag-draped coffins that have arrived at dover air force base.
a few tuesdays ago, the american people embraced this seriousness with regards to america’s policy in iraq.
iraq is descending into chaos based on ethnic divisions that were around long before american troops arrived.
and a report by our own intelligence agencies has concluded that al qaeda is successfully using the war in iraq to recruit a new generation of terrorists for its war on america.
these are serious times for our country, and with their votes two weeks ago, americans demanded a feasible strategy with defined goals in iraq ?
this kind of realism has been missing since the very conception of this war, and it is what led me to publicly oppose it in 2002. the notion that iraq would quickly and easily become a bulwark of flourishing democracy in the middle east was not a plan for victory, but an ideological fantasy.
i said then and believe now that saddam hussein was a ruthless dictator who craved weapons of mass destruction but posed no imminent threat to the united states; that a war in iraq would harm, not help, our efforts to defeat al qaeda and finish the job in afghanistan; and that an invasion would require an occupation of undetermined length, at undetermined cost, with undetermined consequences.
last week, without a trace of irony, the president even chose vietnam as the backdrop for remarks counseling “patience” with his policies in iraq.
at that point, seventy-five u.s. senators, republican and democrat, including myself, had also voted in favor of a resolution demanding that 2006 be a year of significant transition in iraq.
a year in which well-respected republicans like john warner, former administration officials like colin powell, generals who have served in iraq, and intelligence experts have all said that what we are doing is not working.
a year that is ending with an attempt by the bipartisan iraq study group to determine what can be done about a country that is quickly spiraling out of control.
“rejected the notion of an american ‘timeline’ for action on urgent iraqi political issues; ordered american commanders to lift checkpoints they had set up around the shiite district of sadr city to hunt for a kidnapped american soldier and a fugitive shiite death squad leader; and blamed the americans for the deteriorating security situation in iraq.”

this is now the reality of iraq.
now, i am hopeful that the iraq study group emerges next month with a series of proposals around which we can begin to build a bipartisan consensus.
and so the question is not whether there is some magic formula for success, or guarantee against failure, in iraq.
rather, the question is what strategies, imperfect though they may be, are most likely to achieve the best outcome in iraq, one that will ultimately put us on a more effective course to deal with international terrorism, nuclear proliferation, and other critical threats to our security.
what is absolutely clear is that it is not enough for the president to respond to iraq’s reality by saying that he is “open to” or “interested in” new ideas while acting as if all that’s required is doing more of the same.
it may be politically advantageous for the president to simply define victory as staying and defeat as leaving, but it prevents a serious conversation about the realistic objectives we can still achieve in iraq.
namely, preventing iraq from becoming what afghanistan once was, maintaining our influence in the middle east, and forging a political settlement to stop the sectarian violence so that our troops can come home.
there is no reason to believe that more of the same will achieve these objectives in iraq.
the american soldiers i met when i traveled to iraq this year were performing their duties with bravery, with brilliance, and without question.
they have battled insurgents, secured cities, and maintained some semblance of order in iraq.
i have long said that the only solution in iraq is a political one.
to reach such a solution, we must communicate clearly and effectively to the factions in iraq that the days of asking, urging, and waiting for them to take control of their own country are coming to an end.
a phased redeployment of u.s. troops from iraq on a timetable that would begin in four to six months.
that it will be up to them to form a viable government that can effectively run and secure iraq.
the redeployment could be temporarily suspended if the parties in iraq reach an effective political arrangement that stabilizes the situation and they offer us a clear and compelling rationale for maintaining certain troop levels.
drawing down our troops in iraq will allow us to redeploy additional troops to northern iraq and elsewhere in the region as an over-the-horizon force.
this force could help prevent the conflict in iraq from becoming a wider war, consolidate gains in northern iraq, reassure allies in the gulf, allow our troops to strike directly at al qaeda wherever it may exist, and demonstrate to international terrorist organizations that they have not driven us from the region.
the president’s decision to go to war in iraq has had disastrous consequences for afghanistan -- we have seen a fierce taliban offensive, a spike in terrorist attacks, and a narcotrafficking problem spiral out of control.
by redeploying from iraq to afghanistan, we will answer nato’s call for more troops and provide a much-needed boost to this critical fight against terrorism.
as a phased redeployment is executed, the majority of the u.s. troops remaining in iraq should be dedicated to the critical, but less visible roles, of protecting logistics supply points, critical infrastructure, and american enclaves like the green zone, as well as acting as a rapid reaction force to respond to emergencies and go after terrorists.
in such a scenario, it is conceivable that a significantly reduced u.s. force might remain in iraq for a more extended period of time.
we would make clear in such a scenario that the united states would not be maintaining permanent military bases in iraq, but would do what was necessary to help prevent a total collapse of the iraqi state and further polarization of iraqi society.
any u.s. strategy must address the problem of sectarian militias in iraq.
in the absence of a genuine commitment on the part of all of the factions in iraq to deal with this issue, it is doubtful that a unified iraqi government can function for long, and it is doubtful that u.s. forces, no matter how large, can prevent an escalation of widespread sectarian killing.
the third part of our strategy should be to link continued economic aid in iraq with the existence of tangible progress toward a political settlement.
so far, congress has given the administration unprecedented flexibility in determining how to spend more than $20 billion dollars in iraq.
finally, we have to realize that the entire middle east has an enormous stake in the outcome of iraq, and we must engage neighboring countries in finding a solution.
but neither iran nor syria want to see a security vacuum in iraq filled with chaos, terrorism, refugees, and violence, as it could have a destabilizing effect throughout the entire region ?
the goal of this conference should be to get foreign fighters out of iraq, prevent a further descent into civil war, and push the various iraqi factions towards a political solution.
if the iranians and syrians think they can use iraq as another afghanistan or a staging area from which to attack israel or other countries, they are badly mistaken.
as we change strategy in iraq, we should also think about what iraq has taught us about america’s strategy in the wider struggle against rogue threats and international terrorism.
many who supported the original decision to go to war in iraq have argued that it has been a failure of implementation.
much has been written about how the military invasion of iraq was planned without any thought to what political situation we would find after baghdad fell.
threats we haven’t paid nearly enough attention to because we have been distracted in iraq.
the national intelligence estimate, which details how we’re creating more terrorists in iraq than we’re defeating, is the most obvious example of how the war is hurting our efforts in the larger battle against terrorism.
the overwhelming presence of our troops, our intelligence, and our resources in iraq has stretched our military to the breaking point and distracted us from the growing threats of a dangerous world.
there is one other place where our mistakes in iraq have cost us dearly ?
but to guard against isolationist sentiments in this country, we must change conditions in iraq and the policy that has characterized our time there ?
i spoke here a year ago and delivered a message about iraq that was similar to the one i did today.
the time for waiting in iraq is over.","doc1.txt,doc2.txt,doc3.txt,doc5.txt"
time,"i became a civil rights lawyer, and taught constitutional law, and after a time, i came to understand that our cherished rights of liberty and equality depend on the active participation of an awakened electorate.
i know i haven't spent a lot of time learning the ways of washington.
each and every time, a new generation has risen up and done what's needed to be done.
today we are called once more - and it is time for our generation to answer that call.
the time for that politics is over.
it's time to turn the page.
america, it's time to start bringing our troops home.
it's time to admit that no amount of american lives can resolve the political disagreement that lies at the heart of someone else's civil war.
it will take your time, your energy, and your advice - to push us forward when we're doing right, and to let us know when we're not.
and if you will join me in this improbable quest, if you feel destiny calling, and see as i see, a future of endless possibility stretching before us; if you sense, as i sense, that the time is now to shake off our slumber, and slough off our fear, and make good on the debt we owe past and future generations, then i'm ready to take up the cause, and march with you, and work with you.
i am grateful to finish this journey with one of the finest statesmen of our time, a man at ease with everyone from world leaders to the conductors on the amtrak train he still takes home every night.
but the record's clear: john mccain has voted with george bush ninety percent of the time.
senator mccain likes to talk about judgment, but really, what does it say about your judgment when you think george bush has been right more than ninety percent of the time?
well it's time for them to own their failure.
it's time for us to change america.
in that time, he's said no to higher fuel-efficiency standards for cars, no to investments in renewable energy, no to renewable fuels.
now is the time to end this addiction, and to understand that drilling is a stop-gap measure, not a long-term solution.
america, now is not the time for small plans.
now is the time to finally meet our moral obligation to provide every child a world-class education, because it will take nothing less to compete in the global economy.
now is the time to finally keep the promise of affordable, accessible health care for every single american.
now is the time to help families with paid sick days and better family leave, because nobody in america should have to choose between keeping their jobs and caring for a sick child or ailing parent.
now is the time to change our bankruptcy laws, so that your pensions are protected ahead of ceo bonuses; and the time to protect social security for future generations.
and now is the time to keep the promise of equal pay for an equal day's work, because i want my daughters to have exactly the same opportunities as your sons.
and today, as my call for a time frame to remove our troops from iraq has been echoed by the iraqi government and even the bush administration, even after we learned that iraq has a $79 billion surplus while we're wallowing in deficits, john mccain stands alone in his stubborn refusal to end a misguided war.
change happens because the american people demand it - because they rise up and insist on new ideas and new leadership, a new politics for a new time.
in the young people who voted for the first time, and in those who got involved again after a very long time.
my friends, we meet here today at a time where we find ourselves at a crossroads in america's history.
it's a time where you can go to any town hall or street corner or coffee shop and hear people express the same anxiety about the future; hear them convey the same uncertainty about the direction we're headed as a country.
that she was born at a time for black folks when lynchings were not uncommon, but voting was.
and she saw people lining up to vote for the first time - and she got in that line - and she never forgot it.
well it's time we finally said we notice, and we care, and we're not gonna settle anymore.
the time for our party's identity crisis is over.
ladies and gentlemen, this is our time.
our time to make a mark on history.
our time to write a new chapter in the american story.
our time to leave our children a country that is freer and kinder, more prosperous and more just than the place we grew up.
and then someday, someday, if our kids get the chance to stand where we are and look back at the beginning of the 21st century, they can say that this was the time when america renewed its purpose.
they can say that this was the time when america found its way.
they can say that this was the time when america learned to dream again.
the first time i came to kenya was in 1987. i had just finished three years of work as a community organizer in low-income neighborhoods of chicago, and was about to enroll in law school.
it can shield a war criminal - even one like felicien kabuga, suspected of helping to finance and orchestrate the rwandan genocide - by allowing him to purchase safe haven for a time and robbing all humanity of the opportunity to bring the criminal to justice.
and this is why the struggle against corruption is one of the great struggles of our time.
they fight the fight of our time.
since that time i have known him through stories - those my mother would tell and those i heard from my relatives here in kenya on my last trip to this country.
it’s not clear that these troop levels are sustainable for a significant period of time, and according to our commanders on the ground, adding american forces will only relieve the iraqis from doing more on their own.
in such a scenario, it is conceivable that a significantly reduced u.s. force might remain in iraq for a more extended period of time.
but to guard against isolationist sentiments in this country, we must change conditions in iraq and the policy that has characterized our time there ?
it’s time that we listen to their concerns and win back their trust.
the time for waiting in iraq is over.
it is time to change our policy.
it is time to give iraqis their country back.
and it is time to refocus america’s efforts on the wider struggle yet to be won.
but this is one story that shows our job is far from finished at a time when demand for these weapons has never been greater.
today, experts tell us that we're in a race against time to prevent this scenario from unfolding.
but we've all seen how it could take far less time for these weapons to leak out and travel around the world, fueling insurgencies and violent conflicts from africa to afghanistan.
time and time again on the trip, i saw their skill and experience when negotiating with the russians.","doc1.txt,doc2.txt,doc3.txt,doc4.txt,doc5.txt,doc6.txt"
war,"in the face of war, you believe there can be peace.
all of us know what those challenges are today - a war with no end, a dependence on oil that threatens our future, schools where too many children aren't learning, and families struggling paycheck to paycheck despite working as hard as they can.
for the last six years we've been told that our mounting debts don't matter, we've been told that the anxiety americans feel about rising health care costs and stagnant wages are an illusion, we've been told that climate change is a hoax, and that tough talk and an ill-conceived war can replace diplomacy, and strategy, and foresight.
but all of this cannot come to pass until we bring an end to this war in iraq.
most of you know i opposed this war from the start.
it's time to admit that no amount of american lives can resolve the political disagreement that lies at the heart of someone else's civil war.
finally, there is one other thing that is not too late to get right about this war - and that is the homecoming of the men and women - our veterans - who have sacrificed the most.
we meet at one of those defining moments - a moment when our nation is at war, our economy is in turmoil, and the american promise has been threatened once more.
for while senator mccain was turning his sights to iraq just days after 9/11, i stood up and opposed this war, knowing that it would distract us from the real threats we face.
and today, as my call for a time frame to remove our troops from iraq has been echoed by the iraqi government and even the bush administration, even after we learned that iraq has a $79 billion surplus while we're wallowing in deficits, john mccain stands alone in his stubborn refusal to end a misguided war.
i will end this war in iraq responsibly, and finish the fight against al qaeda and the taliban in afghanistan.
whether it's the war or katrina or their health care or their jobs, you hear people say that we've finally arrived at a moment where something must change.
i've thought about how she lived to see a world war and a great depression and a second world war, and how she saw her brothers and uncles and nephews and cousins coming home from those wars and still have to sit at the back of a bus.
in a century just six years old, our faith has been shaken by war and terror, disaster and despair, threats to the middle-class dream, and scandal and corruption in our government.
and when we do go to war, let us always be honest with the american people about why we are there and how we will win.
but for all the progress that has been made, we must surely acknowledge that neither kenya nor the african continent have yet fulfilled their potential - that the hopefulness of the post-colonial era has been replaced by cynicism and sometimes despair, and that true freedom has not yet been won for those struggling to live on less than a few shillings a day, for those who have fallen prey to hiv/aids or malaria, to those ordinary citizens who continue to find themselves trapped in the crossfire of war or ethnic conflict.
it can shield a war criminal - even one like felicien kabuga, suspected of helping to finance and orchestrate the rwandan genocide - by allowing him to purchase safe haven for a time and robbing all humanity of the opportunity to bring the criminal to justice.
americans were originally persuaded by the president to go to war in part because of the threat of weapons of mass destruction, and in part because they were told that it would help reduce the threat of international terrorism.
and now, after three long years of watching the same back and forth in washington, the american people have sent a clear message that the days of using the war on terror as a political football are over.
2,867 americans have now died in this war.
and a report by our own intelligence agencies has concluded that al qaeda is successfully using the war in iraq to recruit a new generation of terrorists for its war on america.
this kind of realism has been missing since the very conception of this war, and it is what led me to publicly oppose it in 2002. the notion that iraq would quickly and easily become a bulwark of flourishing democracy in the middle east was not a plan for victory, but an ideological fantasy.
i said then and believe now that saddam hussein was a ruthless dictator who craved weapons of mass destruction but posed no imminent threat to the united states; that a war in iraq would harm, not help, our efforts to defeat al qaeda and finish the job in afghanistan; and that an invasion would require an occupation of undetermined length, at undetermined cost, with undetermined consequences.
month after month, and then year after year, i’ve watched with a heavy heart as my deepest suspicions about this war’s conception have been confirmed and exacerbated in its disastrous implementation.
when i came here and gave a speech on this war a year ago, i suggested that we begin to move towards a phased redeployment of american troops from iraqi soil.
and i believe that it remains possible to salvage an acceptable outcome to this long and misguided war.
for the fact is that there are no good options left in this war.
and it is not enough for the president to tell us that victory in this war is simply a matter of american resolve.
and, while some have proposed escalating this war by adding thousands of more troops, there is little reason to believe that this will achieve these results either.
moreover, without a coherent strategy or better cooperation from the iraqis, we would only be putting more of our soldiers in the crossfire of a civil war.
but even as they have carried out their responsibilities with excellence and valor, they have also told me that there is no military solution to this war.
this force could help prevent the conflict in iraq from becoming a wider war, consolidate gains in northern iraq, reassure allies in the gulf, allow our troops to strike directly at al qaeda wherever it may exist, and demonstrate to international terrorist organizations that they have not driven us from the region.
the president’s decision to go to war in iraq has had disastrous consequences for afghanistan -- we have seen a fierce taliban offensive, a spike in terrorist attacks, and a narcotrafficking problem spiral out of control.
this must end in the next session of congress, when we reassert our authority to oversee the management of this war.
the goal of this conference should be to get foreign fighters out of iraq, prevent a further descent into civil war, and push the various iraqi factions towards a political solution.
many who supported the original decision to go to war in iraq have argued that it has been a failure of implementation.
that the rationale behind the war itself was misguided.
the second lesson is that in any conflict, it is not enough to simply plan for war; you must also plan for success.
the national intelligence estimate, which details how we’re creating more terrorists in iraq than we’re defeating, is the most obvious example of how the war is hurting our efforts in the larger battle against terrorism.
of course, dick has been there and he has done that, and thanks to the cooperative threat reduction programs he co-founded with senator sam nunn, we've made amazing progress in finding, securing, and guarding some of the deadliest weapons that were left scattered throughout the former soviet union after the cold war.
throughout the cold war, the soviet union was engaged in a massive undertaking in the field of germ warfare.","doc1.txt,doc2.txt,doc3.txt,doc4.txt,doc5.txt,doc6.txt"
